{
  "id": "owasp-llm06-2025-excessive-agency",
  "name": "OWASP LLM06 Excessive Agency",
  "description": "OWASP category for LLM systems granted excessive autonomy, permissions, or action scope.",
  "version": "1.0.0",
  "status": "active",
  "tags": ["owasp", "llm06", "agency"],
  "owasp_version": "2025",
  "category_id": "LLM06",
  "category_name": "Excessive Agency",
  "planning_relevance": "Use for tool misuse, autonomous action, permission boundary, and human approval objectives.",
  "related_entities": [
    "obj-tool-misuse-resilience",
    "obj-excessive-agency-resilience",
    "af-tool-abuse",
    "mit-least-privilege",
    "mit-human-approval"
  ],
  "references": ["ref-owasp-llm-top-10-2025"],
  "created_at": "2026-07-08",
  "updated_at": "2026-07-08"
}
